{
    "name": "decision-notebook",
    "title": "Decision notebook",
    "description": "Keep conversation decisions, with Pi proposals and owner-only human acceptance commands and a read-only notebook page. Stores namespaced Durable documents; reads no outside files or secrets, starts no processes, and makes no network calls.",
    "tags": ["decisions", "notes", "conversation", "approval"],
    "author": { "name": "Tanner Middleton", "github": "TannerMidd" },
    "version": "0.1.0",
    "source": {
        "repo": "TannerMidd/pi-pocket-decision-notebook",
        "commit": "e83a43fb977ee4674bf6583c51066bb2ceef36ee",
        "path": ""
    },
    "files": [
        {
            "name": "decision-notebook.ts",
            "sha256": "0cbe534a35a8577e7e79707953ef48652d7753d373ea441bf40a70cd2b62eea0",
            "size": 11026
        },
        {
            "name": "decision-notebook/index.js",
            "sha256": "42ada03c90cbd2ede6cff2b9d89775dd60fecf5c078a51edbb8ce6f62d94f5f2",
            "size": 18656
        },
        {
            "name": "decision-notebook/state.ts",
            "sha256": "c8e4568f0196bbca7503358b136059c79b28a23579de03a22ed05cb8c820e7b7",
            "size": 7983
        },
        {
            "name": "decision-notebook/style.css",
            "sha256": "664d62b8b073e1ed63cf0ac97264e493b56dc90ac019e6622fcf5d9b21a1d935",
            "size": 3320
        }
    ],
    "pocketApi": 1,
    "minPocket": "0.14.0",
    "declares": {
        "extensions": ["decision-notebook"],
        "tools": ["decision_notebook_propose", "decision_notebook_list"],
        "readOnlyTools": ["decision_notebook_list"],
        "hooks": [],
        "sections": [],
        "wraps": [],
        "routes": ["GET notebook/:conversation"],
        "client": "owner",
        "access": "owner",
        "commands": [
            "conversation decision-notebook-open",
            "conversation decision-notebook-accept",
            "conversation decision-notebook-supersede"
        ]
    },
    "revoked": []
}
